smartctl 7.5 2025-04-30 r5714 [x86_64-linux-6.15.6-arch1-1] (local build)
Copyright (C) 2002-25, Bruce Allen, Christian Franke, www.smartmontools.org

=== START OF INFORMATION SECTION ===
Model Number:                       T-FORCE TM8FF1004T
Serial Number:                      TPBF2401080040100096
Firmware Version:                   EQFM22.3
PCI Vendor/Subsystem ID:            0x1987
IEEE OUI Identifier:                0x6479a7
Controller ID:                      0
NVMe Version:                       2.0
Number of Namespaces:               1
Namespace 1 Size/Capacity:          4,000,787,030,016 [4.00 TB]
Namespace 1 Formatted LBA Size:     512
Namespace 1 IEEE EUI-64:            6479a7 8c0a200f29
Local Time is:                      Sat Jul 12 12:22:13 2025 PDT
Firmware Updates (0x12):            1 Slot, no Reset required
Optional Admin Commands (0x0017):   Security Format Frmw_DL Self_Test
Optional NVM Commands (0x005e):     Wr_Unc DS_Mngmt Wr_Zero Sav/Sel_Feat Timestmp
Log Page Attributes (0x3e):         Cmd_Eff_Lg Ext_Get_Lg Telmtry_Lg Pers_Ev_Lg Log0_FISE_MI
Maximum Data Transfer Size:         128 Pages
Warning  Comp. Temp. Threshold:     87 Celsius
Critical Comp. Temp. Threshold:     89 Celsius

Supported Power States
St Op     Max   Active     Idle   RL RT WL WT  Ent_Lat  Ex_Lat
 0 +    11.50W       -        -    0  0  0  0      800    1000
 1 +     8.00W       -        -    0  0  0  0      800    1000
 2 +     6.00W       -        -    0  0  0  0      800    1000
 3 -   0.1440W       -        -    0  0  0  0     3000    3000
 4 -   0.1440W       -        -    0  0  0  0     3000    3000

Supported LBA Sizes (NSID 0x1)
Id Fmt  Data  Metadt  Rel_Perf
 0 +     512       0         1
 1 -    4096       0         0

=== START OF SMART DATA SECTION ===
SMART overall-health self-assessment test result: PASSED

SMART/Health Information (NVMe Log 0x02, NSID 0xffffffff)
Critical Warning:                   0x00
Temperature:                        29 Celsius
Available Spare:                    100%
Available Spare Threshold:          5%
Percentage Used:                    0%
Data Units Read:                    12,202,648 [6.24 TB]
Data Units Written:                 10,998,899 [5.63 TB]
Host Read Commands:                 90,303,468
Host Write Commands:                135,257,245
Controller Busy Time:               268
Power Cycles:                       57
Power On Hours:                     2,663
Unsafe Shutdowns:                   21
Media and Data Integrity Errors:    0
Error Information Log Entries:      0
Warning  Comp. Temperature Time:    0
Critical Comp. Temperature Time:    0
Thermal Temp. 1 Transition Count:   3
Thermal Temp. 2 Transition Count:   1
Thermal Temp. 1 Total Time:         10
Thermal Temp. 2 Total Time:         6

Error Information (NVMe Log 0x01, 16 of 16 entries)
No Errors Logged

Self-test Log (NVMe Log 0x06, NSID 0xffffffff)
Self-test status: No self-test in progress
No Self-tests Logged

